{
  "version": 1,
  "genere": "2026-10-16T16:21:04Z",
  "id": 13928,
  "date": "2015-02-17",
  "nom": "Séance du mardi 17 février 2015",
  "lien": "https://www.vd.ch/gc/seances-precedentes/annee-2015/seance-du-17-fevrier-2015",
  "ordre_du_jour": [
    {
      "numero": "3",
      "titre": "Interpellation Christiane Jaquet-Berger et consorts - A quoi rime la limitation de l'âge d'engagement des assesseurs des Justices de Paix ? (Pas de développement).",
      "categorie": null,
      "resultat": "RENV-CE",
      "objet": "vd/15_INT_342"
    },
    {
      "numero": "4",
      "titre": "Interpellation Frédéric Borloz - Prosélytisme et culture générale à l'EPSIC (Développement).",
      "categorie": null,
      "resultat": "RENV-CE",
      "objet": "vd/15_INT_338"
    },
    {
      "numero": "5",
      "titre": "Interpellation Jean-Michel Dolivo - Aide et soins à domicile : la paperasse doit-elle passer avant le temps disponible pour le-la patient-e ? (Développement).",
      "categorie": null,
      "resultat": "RENV-CE",
      "objet": "vd/15_INT_341"
    },
    {
      "numero": "6",
      "titre": "Interpellation Alice Glauser - Le SAN se rend-il compte des graves dégâts qu'il occasionne ? (Développement).",
      "categorie": null,
      "resultat": "RENV-CE",
      "objet": "vd/15_INT_344"
    },
    {
      "numero": "7",
      "titre": "Résolution Martine Meldem et consorts - Un canton sans OGM, c'est bien, une Suisse sans OGM, c'est mieux ! (Développement).",
      "categorie": null,
      "resultat": "RENV-CE",
      "objet": "vd/15_RES_020"
    },
    {
      "numero": "8",
      "titre": "Motion Pierre-André Pernoud et consorts au nom des groupes UDC, PLR et Vert'libéraux - Amnistie fiscale / procédure simplifiée (Développement et demande de renvoi en commission avec au moins 20 signatures).",
      "categorie": null,
      "resultat": "RENV-COM",
      "objet": "vd/15_MOT_061"
    },
    {
      "numero": "9",
      "titre": "Postulat François Payot et consorts - Pour une réalisation d'une aire de repos - restoroute sur l'A5 à Concise (Développement et demande de renvoi en commission avec au moins 20 signatures).",
      "categorie": null,
      "resultat": "RENV-COM",
      "objet": "vd/15_POS_105"
    },
    {
      "numero": "10",
      "titre": "Postulat Jean-Michel Dolivo et consorts - Le Revenu déterminant unifié (RDU) répond-t-il aux objectifs poursuivis par la loi ? (Développement et demande de prise en considération immédiate).",
      "categorie": null,
      "resultat": "RENV-COM",
      "objet": "vd/15_POS_104"
    },
    {
      "numero": "11",
      "titre": "Exposé des motifs et projets de lois - modifiant la loi du 4 juillet 2006 sur l'exécution des condamnations pénales (LEP) – Suites du rapport d'enquête administrative sur le drame de Payerne - modifiant la loi du 7 novembre 2006 sur l'exécution de la détention avant jugement- modifiant la loi du 29 mai 1985 sur la santé publique etRapport du Conseil d'Etat au Grand Conseil sur le postulat Jacques-André Haury et consorts au nom de la Commission de haute surveillance du Tribunal cantonal demandant deux modifications rapides de la LEP à la suite du drame de Payerne.(Suite des débats) (1er débat)",
      "categorie": null,
      "resultat": "OA+M",
      "objet": null
    },
    {
      "numero": "12",
      "titre": "Rapport du Conseil d'Etat et du Tribunal Cantonal au Grand Conseil : Bilan sur la réforme cas lourds.",
      "categorie": null,
      "resultat": "OA",
      "objet": null
    },
    {
      "numero": "13",
      "titre": "Motion Albert Chapalay et consorts - Modification du mode de perception de la participation des communes à la facture sociale. DIS, DSAS.",
      "categorie": null,
      "resultat": "RENV-T",
      "objet": "vd/14_MOT_055"
    },
    {
      "numero": "14",
      "titre": "Rapport du Conseil d'Etat au Grand Conseil• sur le postulat Nicolas Rochat \"Hausse des primes d'assurance-maladie, une solution cantonale s'impose !\" (11_POS_289)et Réponse du Conseil d'Etat• à la pétition pour la transparence et l'équité dans l'assurance-maladie et pour des primes reflétant vraiment les coûts des soins (08_PET_025) ;• à la résolution des Présidents des groupes politiques sur le non-remboursement des primes d'assurance-maladie (13_RES_005);• à la détermination Nicolas Rochat sur la réponse du Conseil d'Etat à son interpellation \"Transferts des réserves excédentaires des caisses maladie : quelle SUPRAsolidarité en faveur des assuré-e-s vaudois-e-s\" (10_INT_420)",
      "categorie": null,
      "resultat": "RENV-T",
      "objet": null
    },
    {
      "numero": "15",
      "titre": "Réponse du Conseil d'Etat à l'interpellation Jean-Marie Surer et consorts - Factures de la CSS payées à tort, à qui la responsabilité ? DSAS.",
      "categorie": null,
      "resultat": "RENV-T",
      "objet": "vd/14_INT_294"
    },
    {
      "numero": "16",
      "titre": "Réponse du Conseil d'Etat à l'interpellation Christa Calpini - Quel avenir pour les physiothérapeutes indépendants dans le Canton de Vaud ?",
      "categorie": null,
      "resultat": "RENV-T",
      "objet": "vd/14_PET_027"
    },
    {
      "numero": "18",
      "titre": "Exposé des motifs et projet de loi du Grand Conseil modifiant la loi sur le Grand Conseil du 8 mai 2007 et Rapport du Grand Conseil sur la motion François Brélaz et consorts proposant de définir clairement la notion de groupe politique dans la Loi sur le Grand Conseil (1er débat).",
      "categorie": null,
      "resultat": "RENV-T",
      "objet": null
    },
    {
      "numero": "19",
      "titre": "Exposé des motifs et projet de décret ordonnant la convocation des électeurs pour se prononcer sur la modification de l'art. 93 de la Constitution du Canton de Vaud du 14 avril 2003 (Cst-VD) etExposé des motifs et projet de loi du Grand Conseil modifiant la loi du 16 mai 1989 sur l'exercice des droits politiques (LEDP) et Rapport du Grand Conseil sur la motion Régis Courdesse et consorts au nom du groupe vert'libéral demandant une modification de l'article 61, lettre a, chiffres 1 et 2, de la loi sur l'exercice des droits politiques (1er débat).",
      "categorie": null,
      "resultat": "RENV-T",
      "objet": null
    },
    {
      "numero": "20",
      "titre": "Motion Jean-Michel Dolivo et consorts pour la transparence des rémunérations dans le secteur subventionné vaudois.",
      "categorie": null,
      "resultat": "REF",
      "objet": "vd/14_MOT_040"
    },
    {
      "numero": "21",
      "titre": "Réponse du Conseil d'Etat à l'interpellation Denis Rubattel - Nominations dans les Conseils d'administration : les compétences priment-elles véritablement ?",
      "categorie": null,
      "resultat": "TRAITE",
      "objet": "vd/14_INT_263"
    },
    {
      "numero": "22",
      "titre": "Motion Guy-Philippe Bolay et consorts pour une meilleure prise de conscience des amendements budgétaires à la hausse.",
      "categorie": null,
      "resultat": "REF",
      "objet": "vd/14_MOT_046"
    },
    {
      "numero": "23",
      "titre": "Postulat Vassilis Venizelos pour appliquer une bonne règle à des sites d'exception. DFIRE, DFJC.",
      "categorie": null,
      "resultat": "RENV-CE",
      "objet": "vd/14_POS_061"
    },
    {
      "numero": "24",
      "titre": "Postulat Yves Ferrari et consorts pour une politique cohérente de conservation du patrimoine architectural et archéologique.",
      "categorie": null,
      "resultat": "RENV-CE",
      "objet": "vd/14_POS_065"
    },
    {
      "numero": "25",
      "titre": "Postulat Jérôme Christen pour une véritable politique de préservation du patrimoine architectural et archéologique dans le canton de Vaud.",
      "categorie": null,
      "resultat": "RENV-CE",
      "objet": "vd/14_POS_066"
    },
    {
      "numero": "26",
      "titre": "Réponse du Conseil d'Etat à l'interpellation José Durussel - Sécurité des sites et monuments historiques, attention danger, on ferme !",
      "categorie": null,
      "resultat": "TRAITE",
      "objet": "vd/13_INT_169"
    },
    {
      "numero": "27",
      "titre": "Réponse du Conseil d'Etat à l'interpellation Jean-Marc Chollet - A qui profitera la vente du courant électrique produit par des panneaux photovoltaïques posés ou à poser sur des bâtiments de l'Etat de Vaud ?",
      "categorie": null,
      "resultat": "TRAITE",
      "objet": "vd/14_INT_260"
    },
    {
      "numero": "28",
      "titre": "Réponse du Conseil d'Etat à l'interpellation Julien Eggenberger - Les Vaudoises et Vaudois paieront-ils les amendes des banques ?",
      "categorie": null,
      "resultat": null,
      "objet": "vd/14_INT_272"
    },
    {
      "numero": "29",
      "titre": "Réponse du Conseil d'Etat à l'interpellation Vassilis Venizelos - Un impôt heureux, une fiscalité durable",
      "categorie": null,
      "resultat": "TRAITE",
      "objet": "vd/14_INT_287"
    }
  ]
}
