{
  "version": 1,
  "genere": "2026-10-16T16:21:04Z",
  "id": 33119,
  "date": "2021-05-06T20:00",
  "nom": "Séance du Conseil communal du 6 mai 2021",
  "lien": "https://www.yverdon-les-bains.ch/vie-politique/conseil-communal/seances",
  "ordre_du_jour": [
    {
      "numero": "1",
      "titre": "Appel",
      "categorie": null,
      "resultat": null,
      "objet": null
    },
    {
      "numero": "2",
      "titre": "Approbation de l’ordre du jour",
      "categorie": null,
      "resultat": null,
      "objet": null
    },
    {
      "numero": "3",
      "titre": "Approbation du procès-verbal de la séance du 25 mars 2021",
      "categorie": null,
      "resultat": null,
      "objet": null
    },
    {
      "numero": "4",
      "titre": "Nomination d'une secrétaire adjointe pour la fin de la législature 2016-2021",
      "categorie": null,
      "resultat": null,
      "objet": null
    },
    {
      "numero": "5",
      "titre": "Assermentations",
      "categorie": null,
      "resultat": null,
      "objet": null
    },
    {
      "numero": "6",
      "titre": "Communications de la Présidente",
      "categorie": null,
      "resultat": null,
      "objet": null
    },
    {
      "numero": "7",
      "titre": "Communications et réponses de la Municipalité : CO21.05",
      "categorie": null,
      "resultat": null,
      "objet": null
    },
    {
      "numero": "8",
      "titre": "PO18.01REP sur le postulat du 22 mars 2018 de Madame la Conseillère communale Natacha Ribeaud Eddahbi intitulé « Femmes en marche : un autre regard sur l’espace urbain »",
      "categorie": null,
      "resultat": null,
      "objet": null
    },
    {
      "numero": "9",
      "titre": "Interpellations, simples questions et vœux reportés de la séance du 4 février 2021",
      "categorie": null,
      "resultat": null,
      "objet": null
    },
    {
      "numero": "10",
      "titre": "PR21.01PR concernant une demande de crédit d’étude de CHF 215’000.- pour la participation de la Ville aux études de faisabilité et de changement d’affectation du site « Aux Isles », afin d’y accueillir les futures installations de services communaux, de TRAVYS et de CarPostal",
      "categorie": null,
      "resultat": null,
      "objet": null
    },
    {
      "numero": "11",
      "titre": "PR21.04PR concernant une demande de crédits d’investissement de CHF 5'000’000.- pour le renouvellement des réseaux eau, gaz, électricité de la ville et de CHF 350’000.- pour la réfection des chaussées et canalisations relatives aux secteurs d’intervention du Service des énergies pour l’année 2021",
      "categorie": null,
      "resultat": null,
      "objet": null
    },
    {
      "numero": "12",
      "titre": "PR21.05PR concernant l’adoption du projet de modification des voiries sur la route de Lausanne pour la création d’un by-pass sur le giratoire sud de la jonction autoroutière Yverdon-Sud, en application de la loi du 10 décembre 1991 sur les routes et de la loi du 25 novembre 1974 sur l'expropriation Propositions individuelles",
      "categorie": null,
      "resultat": null,
      "objet": null
    },
    {
      "numero": "13",
      "titre": "PO21.05PO Postulat de [particulier] « Covid-19 : protégeons la santé mentale des jeunes Yverdonnois et Yverdonnoises »",
      "categorie": null,
      "resultat": null,
      "objet": null
    },
    {
      "numero": "14",
      "titre": "PO21.06PO Postulat de [particulier] « Des alternatives locales et écologiques au béton »",
      "categorie": null,
      "resultat": null,
      "objet": null
    },
    {
      "numero": "15",
      "titre": "Interpellations, simples questions et vœux.",
      "categorie": null,
      "resultat": null,
      "objet": null
    }
  ]
}
