{
  "version": 1,
  "genere": "2026-10-16T16:21:04Z",
  "id": 13954,
  "date": "2015-11-10",
  "nom": "Séance du mardi 10 novembre 2015",
  "lien": "https://www.vd.ch/gc/seances-precedentes/annee-2015/seance-du-mardi-10-novembre-2015",
  "ordre_du_jour": [
    {
      "numero": "4",
      "titre": "Interpellation Pierre Volet - Fermeture du bureau de douane de Vevey port-franc (Pas de développement).",
      "categorie": null,
      "resultat": "RENV-CE",
      "objet": "vd/15_INT_442"
    },
    {
      "numero": "5",
      "titre": "Interpellation Manuel Donzé et consorts - Electrosanne, la mort trop silencieuse d'un festival. Quelle place veut accorder le Conseil d'Etat aux musiques actuelles ? (Développement).",
      "categorie": null,
      "resultat": "RENV-CE",
      "objet": "vd/15_INT_437"
    },
    {
      "numero": "6",
      "titre": "Interpellation Catherine Labouchère - Augmentation prévue pour les subsides LAMAL, des explications svp (Développement).",
      "categorie": null,
      "resultat": "RENV-CE",
      "objet": "vd/15_INT_438"
    },
    {
      "numero": "7",
      "titre": "Interpellation Vassilis Venizelos - Mise en oeuvre de la LAT : que compte faire le Conseil d'Etat pour ne pas condamner durablement le développement du canton ? (Développement).",
      "categorie": null,
      "resultat": "RENV-CE",
      "objet": "vd/15_INT_441"
    },
    {
      "numero": "8",
      "titre": "Motion Lena Lio et consorts - Pour une adaptation des dérogations au lieu de scolarisation, dans l'école obligatoire publique (Développement et demande de renvoi à commission avec au moins 20 signatures).",
      "categorie": null,
      "resultat": "RENV-COM",
      "objet": "vd/15_MOT_076"
    },
    {
      "numero": "9",
      "titre": "Interpellation Alain Bovay - Ancien dirigeant de la BCV acquitté : 1.8 million à la charge du contribuable, comment en est-on arrivé là ? (Développement).",
      "categorie": null,
      "resultat": "RENV-CE",
      "objet": "vd/15_INT_443"
    },
    {
      "numero": "10",
      "titre": "Interpellation Alexandre Berthoud et consorts - la \"contrôlite\" aigüe des polices ! (Développement).",
      "categorie": null,
      "resultat": "RENV-CE",
      "objet": "vd/15_INT_444"
    },
    {
      "numero": "11",
      "titre": "Interpellation Philippe Krieg - Croissance de la population vaudoise et infrastructures, le levier inévitable ! (Développement).",
      "categorie": null,
      "resultat": "RENV-CE",
      "objet": "vd/15_INT_445"
    },
    {
      "numero": "12",
      "titre": "Postulat Raphaël Mahaim et consorts - Couverture ECA des bâtiments agricoles : risques de sous-couverture et primes arbitraires (Développemement et demande de renvoi à commission avec au moins 20 signatures).",
      "categorie": null,
      "resultat": "RENV-COM",
      "objet": "vd/15_POS_146"
    },
    {
      "numero": "13",
      "titre": "Initiative Raphaël Mahaim et consorts - Dépouillement lors des scrutins fédéraux : tous les citoyens communaux doivent pouvoir participer ! (Développemement et demande de renvoi à commission avec au moins 20 signatures).",
      "categorie": null,
      "resultat": "RENV-COM",
      "objet": "vd/15_INI_013"
    },
    {
      "numero": "14",
      "titre": "Initiative Raphaël Mahaim et consorts - Calcul des majorités dans les commissions d'un conseil communal : plus de clarté SVP ! (Développement et demande de renvoi à commission avec au moins 20 signatures).",
      "categorie": null,
      "resultat": "RENV-COM",
      "objet": "vd/15_INI_014"
    },
    {
      "numero": "15",
      "titre": "Exposé des motifs complémentaire et Projets de lois- sur la préservation du parc locatif vaudois (LLPL)- modifiant la loi du 6 mai 2006 sur l'énergie etRapports du Conseil d'Etat au Grand Conseil- sur le postulat Jean-Michel Dolivo et consorts \"pour renforcer les droits des locataires dans la loi concernant la démolition, la transformation et la rénovation de maisons d'habitation ainsi que l'utilisation de logements à d'autres fins que l'habitation (LDTR)\" (09_POS_156)- sur le postulat Frédéric Borloz \"Logement : pour le bien des locataires et des propriétaires, dépassons le statut quo !\" (09_POS_157) (Suite des débats) (1er débat)",
      "categorie": null,
      "resultat": "OA+M",
      "objet": null
    },
    {
      "numero": "16",
      "titre": "Motion Jacques Haldy et consorts - Pour permettre la vente par les communes des biens abandonnés par un locataire expulsé. DIS.",
      "categorie": null,
      "resultat": "RENV-CE",
      "objet": "vd/15_MOT_063"
    },
    {
      "numero": "17",
      "titre": "Réponse du Conseil d'Etat à l'interpellation Sylvie Podio - Ouvrir la porte à un désendettement concret des particuliers surendettés. DIS.",
      "categorie": null,
      "resultat": "TRAITE",
      "objet": "vd/14_INT_282"
    },
    {
      "numero": "18",
      "titre": "Rapport annuel 2014 de la CIP - Détention pénale.",
      "categorie": null,
      "resultat": "OA",
      "objet": null
    },
    {
      "numero": "19",
      "titre": "Pétition en faveur de [particulier].",
      "categorie": null,
      "resultat": "REF",
      "objet": "vd/15_PET_031"
    },
    {
      "numero": "20",
      "titre": "Pétition des Jeunes Vert-e-s vaudois-e-s pour une rémunération décente des stages. DECS,",
      "categorie": null,
      "resultat": "RENV-CE",
      "objet": "vd/15_PET_032"
    },
    {
      "numero": "21",
      "titre": "Pétition en faveur de Fitim Gashi.",
      "categorie": null,
      "resultat": "RENV-CE",
      "objet": "vd/15_PET_033"
    },
    {
      "numero": "22",
      "titre": "Pétition en faveur de la famille Cil : Kemal et Hatin, les parents, et Berat et Havin, les enfants.",
      "categorie": null,
      "resultat": "RENV-CE",
      "objet": "vd/15_PET_035"
    },
    {
      "numero": "23",
      "titre": "Pétition en faveur de [particulier] et ses enfants Bleon (10 ans) et Area (3 ans)",
      "categorie": null,
      "resultat": "RENV-CE",
      "objet": "vd/15_PET_036"
    },
    {
      "numero": "24",
      "titre": "Postulat Amélie Cherbuin et consorts - Subventions aux projets régionaux : mesurer la performance et sécuriser le processus de décision. DECS.",
      "categorie": null,
      "resultat": "REF",
      "objet": "vd/15_POS_111"
    },
    {
      "numero": "25",
      "titre": "Réponse du Conseil d'Etat à l'interpellation Catherine Roulet et consort - Quel traitement réserve l'EVAM aux personnes vulnérables, en particulier sur le plan médical ? DECS.",
      "categorie": null,
      "resultat": "TRAITE",
      "objet": "vd/15_INT_330"
    },
    {
      "numero": "26",
      "titre": "Réponse du Conseil d'Etat à l'interpellation Julien Eggenberger et consorts - Subsides au sport : qui paiera le manque à gagner ? DECS.",
      "categorie": null,
      "resultat": "TRAITE",
      "objet": "vd/15_INT_383"
    },
    {
      "numero": "27",
      "titre": "Réponse du Conseil d'Etat à l'interpellation Michel Miéville - Loterie romande : se gratte-t-elle des emplois en Suisse ? DECS.",
      "categorie": null,
      "resultat": "TRAITE",
      "objet": "vd/15_INT_398"
    },
    {
      "numero": "28",
      "titre": "Réponse du Conseil d'Etat à l'interpellation Jérôme Christen et consorts - Loi sur les auberges et débit de boissons : la LADB est-elle une auberge espagnole ? DECS.",
      "categorie": null,
      "resultat": "TRAITE",
      "objet": "vd/15_INT_378"
    },
    {
      "numero": "29",
      "titre": "Réponse du Conseil d'Etat à l'interpellation Fabienne Freymond Cantone et consorts - Interdiction totale de la publicité pour les produits du tabac : cohérence... ? DECS.",
      "categorie": null,
      "resultat": "RENV-T",
      "objet": "vd/14_INT_321"
    },
    {
      "numero": "30",
      "titre": "Postulat Catherine Labouchère et consorts - Jeunes adultes en difficulté (JAD) et les mesures d'insertions sociales (MIS), un accord imparfait à qui il faut redonner le bon tempo. DSAS, DFJC.",
      "categorie": null,
      "resultat": "RENV-CE",
      "objet": "vd/15_POS_117"
    },
    {
      "numero": "31",
      "titre": "Rapport du Conseil d'Etat au Grand Conseil sur les postulats Jean-Michel Dolivo et consorts - Mieux comprendre les maladies et tumeurs hormono dépendantes (en particulier, les cancers du sein et des testicules) pour agir de manière préventive et Fabienne Freymond Cantone et consorts concernant le cancer du sein - Pourquoi cette maladie frappe autant et comment pourrait-on mieux la prévenir",
      "categorie": null,
      "resultat": "RENV-T",
      "objet": null
    },
    {
      "numero": "33",
      "titre": "Réponse du Conseil d'Etat à l'interpellation Philippe Vuillemin - L'Etat se prend-il pour Dieu ? DSAS.",
      "categorie": null,
      "resultat": "TRAITE",
      "objet": "vd/15_INT_372"
    },
    {
      "numero": "34",
      "titre": "Réponse du Conseil d'Etat à l'interpellation François Brélaz - Mettons fin à la discrimination des hygiénistes dentaires vaudois-es ! DSAS.",
      "categorie": null,
      "resultat": "TRAITE",
      "objet": "vd/15_INT_362"
    },
    {
      "numero": "35",
      "titre": "Réponse du Conseil d'Etat à l'interpellation Jérôme Christen - Marchés publics : le remède législatif n'est-il pas devenu pire que mal ? DSAS.",
      "categorie": null,
      "resultat": "TRAITE",
      "objet": "vd/15_INT_388"
    },
    {
      "numero": "36",
      "titre": "Réponse du Conseil d'Etat à l'interpellation Claude-Alain Voiblet - Utilisation des PIG (Prestations d'Intérêt Général) comme un outil de subventionnement \"occulte\" qui pourrait biaiser la concurrence et la réalité des chiffres entre les établissements hospitaliers dans notre pays. DSAS.",
      "categorie": null,
      "resultat": "TRAITE",
      "objet": "vd/15_INT_389"
    }
  ]
}
