{
  "version": 1,
  "genere": "2026-10-16T16:21:04Z",
  "id": 32950,
  "date": "2024-09-12T20:00",
  "nom": "Séance du Conseil communal du 12 septembre 2024",
  "lien": "https://www.yverdon-les-bains.ch/vie-politique/conseil-communal/seances",
  "ordre_du_jour": [
    {
      "numero": "1",
      "titre": "Appel",
      "categorie": null,
      "resultat": null,
      "objet": null
    },
    {
      "numero": "2",
      "titre": "Approbation de l’ordre du jour",
      "categorie": null,
      "resultat": null,
      "objet": null
    },
    {
      "numero": "3",
      "titre": "Approbation du procès-verbal de la séance du 6 juin 2024",
      "categorie": null,
      "resultat": null,
      "objet": null
    },
    {
      "numero": "4",
      "titre": "Approbation du procès-verbal de la séance du 20 juin 2024",
      "categorie": null,
      "resultat": null,
      "objet": null
    },
    {
      "numero": "5",
      "titre": "Démissions",
      "categorie": null,
      "resultat": null,
      "objet": null
    },
    {
      "numero": "6",
      "titre": "Assermentations",
      "categorie": null,
      "resultat": null,
      "objet": null
    },
    {
      "numero": "7",
      "titre": "Communications de la Présidente",
      "categorie": null,
      "resultat": null,
      "objet": null
    },
    {
      "numero": "8",
      "titre": "Communications et réponses de la Municipalité : CO24.04 et CO24.05",
      "categorie": null,
      "resultat": null,
      "objet": null
    },
    {
      "numero": "9",
      "titre": "PO20.08REP sur le postulat PO20.08PO du 1er octobre 2020 de Monsieur le Conseiller communal Ruben RAMCHURN intitulé « Pour des protections hygiéniques gratuites pour les élèves des écoles secondaires yverdonnoises » PO22.01REP sur le postulat PO22.01PO du 3 février 2022 de M. le Conseiller communal Stéphane BALET et consorts intitulé « Quel avenir pour la Police régionale du Nord vaudois (PNV)? »",
      "categorie": null,
      "resultat": null,
      "objet": null
    },
    {
      "numero": "10",
      "titre": "Nomination d'un·e membre suppléant·e à la Commission de recours",
      "categorie": null,
      "resultat": null,
      "objet": null
    },
    {
      "numero": "11",
      "titre": "PR24.12PR concernant une demande de crédit d’investissement de CHF 1'600’000.- pour le lancement des projets prioritaires de transformation numérique de l’administration communale",
      "categorie": null,
      "resultat": null,
      "objet": null
    },
    {
      "numero": "12",
      "titre": "PR24.16PR concernant une demande de crédit d’étude de CHF 70'000.- pour l’établissement d’un plan de marketing urbain pour Yverdon-les-Bains",
      "categorie": null,
      "resultat": null,
      "objet": null
    },
    {
      "numero": "13",
      "titre": "PR24.19PR concernant l’arrêté d’imposition pour l’année 2025",
      "categorie": null,
      "resultat": null,
      "objet": null
    },
    {
      "numero": "14",
      "titre": "PR24.18PR concernant une demande de crédit d’investissement de CHF 4'950’000.- pour financer la phase 4 (2025-2027) du projet Smart Metering",
      "categorie": null,
      "resultat": null,
      "objet": null
    },
    {
      "numero": "15",
      "titre": "PO24.07PO de [particulier] sur « Quelles mesures pour prévenir et suivre la situation du crack à Yverdon-les-Bains »",
      "categorie": null,
      "resultat": null,
      "objet": null
    },
    {
      "numero": "16",
      "titre": "PO24.08PO de [particulier] « Pour que la drogue ne soit plus la carte de visite de notre ville »",
      "categorie": null,
      "resultat": null,
      "objet": null
    },
    {
      "numero": "17",
      "titre": "Interpellations, simples questions et vœux.",
      "categorie": null,
      "resultat": null,
      "objet": null
    }
  ]
}
