{
  "version": 1,
  "genere": "2026-10-31T16:26:32Z",
  "id": null,
  "date": "2012-06-25T20:15",
  "nom": "Séance du Conseil communal de St-Légier - La Chiésaz",
  "lien": "https://www.blonay-saint-legier.ch/_rte/anlass/5068997",
  "ordre_du_jour": [],
  "documents": [
    {
      "titre": "Ordre du jour du 25.06.2012",
      "date": null,
      "lien": "https://www.blonay-saint-legier.ch/_doc/3657914"
    },
    {
      "titre": "Procès-verbal du 25.06.2012",
      "date": null,
      "lien": "https://www.blonay-saint-legier.ch/_doc/3657917"
    }
  ]
}
