{
  "version": 1,
  "genere": "2026-10-16T16:21:04Z",
  "id": 14159,
  "date": "2022-05-17",
  "nom": "Séance du Grand Conseil du mardi 17 mai 2022",
  "lien": "https://www.vd.ch/gc/seances-du-grand-conseil/detail-seance/seance-gc/1004440",
  "ordre_du_jour": [
    {
      "numero": "2",
      "titre": "Postulat Yannick Maury et consorts - Pour ne pas regretter plus tard de s'être mis au service d'une collectivité : affiliation au deuxième pilier pour les municipales, municipaux, députées et députés.",
      "categorie": null,
      "resultat": null,
      "objet": "vd/22_POS_22"
    },
    {
      "numero": "3",
      "titre": "Interpellation Jérôme Christen et consorts au nom Les Libres - Drame de Montreux : que fait l’Etat de Vaud pour protéger les jeunes entraînés dans des dérives sectaires ? (Pas de développement).",
      "categorie": null,
      "resultat": "Transmise au CE",
      "objet": "vd/22_INT_64"
    },
    {
      "numero": "4",
      "titre": "Interpellation Céline Misiego au nom EP - Quelle protection des habitant.e.s face aux nuisances de chantiers ? (Pas de développement).",
      "categorie": null,
      "resultat": "Transmise au CE",
      "objet": "vd/22_INT_66"
    },
    {
      "numero": "5",
      "titre": "Exposé des motifs CONSEIL DE LA MAGISTRATURE",
      "categorie": null,
      "resultat": null,
      "objet": "vd/21_LEG_92"
    },
    {
      "numero": "6",
      "titre": "Rapport de commission de surveillance chargée de contrôler la gestion sur l'utilisation des fonds cantonaux versés à la Fondation de Beaulieu entre 1999 et 2009 et précautions prises pour qu'il n'y ait plus de pertes pour le Canton dans ce dossier.",
      "categorie": null,
      "resultat": "Traité-e",
      "objet": "vd/22_PAR_5"
    },
    {
      "numero": "7",
      "titre": "Rapport de commission de surveillance chargée de contrôler la gestion du Conseil d’État du Canton de Vaud - Année 2021.",
      "categorie": null,
      "resultat": "Renvoyée pour suite des débats",
      "objet": "vd/22_PAR_4"
    },
    {
      "numero": "8",
      "titre": "Interpellation Didier Lohri - Subventions fédérales accordées aux familles vaudoises programme 18-23 (Développement).",
      "categorie": null,
      "resultat": "Renvoyée par manque de temps",
      "objet": "vd/22_INT_62"
    },
    {
      "numero": "9",
      "titre": "Interpellation Cédric Weissert et consorts - Projet Regio - Une situation d'échec ? (Développement).",
      "categorie": null,
      "resultat": "Renvoyée par manque de temps",
      "objet": "vd/22_INT_63"
    },
    {
      "numero": "10",
      "titre": "Interpellation Pierre Wahlen - Quand l’impôt heureux fait sourire la direction d’ADM et rire jaune les contribuables vaudois (Développement).",
      "categorie": null,
      "resultat": "Renvoyée par manque de temps",
      "objet": "vd/22_INT_65"
    },
    {
      "numero": "15",
      "titre": "Rapport intermédiaire du Conseil d'Etat au Grand Conseil sur la Motion Aurélien Clerc et consorts - Valorisation et promotion de la formation duale.",
      "categorie": null,
      "resultat": "Renvoyé par manque de temps",
      "objet": "vd/22_RAI_1"
    },
    {
      "numero": "16",
      "titre": "Motion Gérard Mojon et consorts au nom Commission des finances - Enveloppe financière d'une Commission d'enquête parlementaire, une compétence directe du plénum du Grand Conseil (Développement et demande de prise en considération immédiate).",
      "categorie": null,
      "resultat": "Renvoyée par manque de temps",
      "objet": "vd/22_MOT_16"
    },
    {
      "numero": "17",
      "titre": "Motion Philippe Jobin et consorts - Pour que la LPPPL remplisse sa mission, modifions l'article 14 LPPPL.",
      "categorie": null,
      "resultat": "Renvoyée par manque de temps",
      "objet": "vd/19_MOT_114"
    }
  ]
}
