{
  "version": 1,
  "genere": "2026-10-16T16:21:04Z",
  "id": 32955,
  "date": "2022-06-02T20:00",
  "nom": "Séance du Conseil communal du 2 juin 2022",
  "lien": "https://www.yverdon-les-bains.ch/vie-politique/conseil-communal/seances",
  "ordre_du_jour": [
    {
      "numero": "1",
      "titre": "Appel",
      "categorie": null,
      "resultat": null,
      "objet": null
    },
    {
      "numero": "2",
      "titre": "Approbation de l’ordre du jour",
      "categorie": null,
      "resultat": null,
      "objet": null
    },
    {
      "numero": "3",
      "titre": "Approbation du procès-verbal de la séance du 4 novembre 2021",
      "categorie": null,
      "resultat": null,
      "objet": null
    },
    {
      "numero": "4",
      "titre": "Approbation du procès-verbal de la séance du 2 décembre 2021",
      "categorie": null,
      "resultat": null,
      "objet": null
    },
    {
      "numero": "5",
      "titre": "Approbation du procès-verbal de la séance du 9 décembre 2021",
      "categorie": null,
      "resultat": null,
      "objet": null
    },
    {
      "numero": "6",
      "titre": "Démissions",
      "categorie": null,
      "resultat": null,
      "objet": null
    },
    {
      "numero": "7",
      "titre": "Assermentations",
      "categorie": null,
      "resultat": null,
      "objet": null
    },
    {
      "numero": "8",
      "titre": "Communications de la Présidente",
      "categorie": null,
      "resultat": null,
      "objet": null
    },
    {
      "numero": "9",
      "titre": "Communications et réponses de la Municipalité",
      "categorie": null,
      "resultat": null,
      "objet": null
    },
    {
      "numero": "10",
      "titre": "Nomination de deux membres à la Commission des affaires immobilières",
      "categorie": null,
      "resultat": null,
      "objet": null
    },
    {
      "numero": "11",
      "titre": "Nomination de deux membres à la Commission des pétitions",
      "categorie": null,
      "resultat": null,
      "objet": null
    },
    {
      "numero": "12",
      "titre": "PO20.13REP le postulat du 4 février 2021 de M. le Conseiller communal Roland Villard intitulé « Pour un plan de relance ainsi qu’une augmentation de l’offre culturelle à Yverdon »",
      "categorie": null,
      "resultat": null,
      "objet": null
    },
    {
      "numero": "13",
      "titre": "PR22.06PR concernant une demande de crédit d’étude de CHF 750'000.- pour les études de projet du réaménagement du tronçon central de la rue des Moulins, entre la rue du Midi et l’Avenue Kiener",
      "categorie": null,
      "resultat": null,
      "objet": null
    },
    {
      "numero": "14",
      "titre": "PR22.07PR concernant une demande de crédit d'investissement de CHF 300'000.- pour l'assainissement des sous-stations de chauffage du collège Léon-Michaud suite au raccordement au CAD-Santal",
      "categorie": null,
      "resultat": null,
      "objet": null
    },
    {
      "numero": "15",
      "titre": "P021.09PO Postulat de [particulier] « Pour le respect du français académique, contre l’écriture dite inclusive »",
      "categorie": null,
      "resultat": null,
      "objet": null
    },
    {
      "numero": "16",
      "titre": "Interpellations, simples questions et vœux.",
      "categorie": null,
      "resultat": null,
      "objet": null
    }
  ]
}
