{
  "version": 1,
  "genere": "2026-10-31T14:52:49Z",
  "id": null,
  "date": "2022-12-12",
  "nom": "Séance Conseil Communal de Hautemorges",
  "lien": "https://www.hautemorges.ch/_rte/anlass/4951009",
  "ordre_du_jour": [],
  "documents": [
    {
      "titre": "2022_12_12_Convocation_CC.pdf",
      "date": null,
      "lien": "https://www.hautemorges.ch/_doc/4145096"
    },
    {
      "titre": "Preavis_16_2022_-_Budget_2023.pdf",
      "date": null,
      "lien": "https://www.hautemorges.ch/_doc/4145099"
    },
    {
      "titre": "Preavis_17_2022_-_Reglement_eau.pdf",
      "date": null,
      "lien": "https://www.hautemorges.ch/_doc/4145102"
    },
    {
      "titre": "Preavis_17_2022_-_Reglement_eau_-_annexe_1.pdf",
      "date": null,
      "lien": "https://www.hautemorges.ch/_doc/4145105"
    },
    {
      "titre": "Preavis_17_2022_-_Reglement_eau_-_annexe_2.pdf",
      "date": null,
      "lien": "https://www.hautemorges.ch/_doc/4145108"
    },
    {
      "titre": "Preavis_17_2022_-_Reglement_eau_-_annexe_3.pdf",
      "date": null,
      "lien": "https://www.hautemorges.ch/_doc/4145111"
    },
    {
      "titre": "Preavis_18_2022_-_Reglement_cimetiere.pdf",
      "date": null,
      "lien": "https://www.hautemorges.ch/_doc/4145114"
    },
    {
      "titre": "Preavis_18_2022_-_Reglement_cimetiere_-_annexe.pdf",
      "date": null,
      "lien": "https://www.hautemorges.ch/_doc/4145117"
    },
    {
      "titre": "Preavis_19_2022_-_Report_reglement_dechets.pdf",
      "date": null,
      "lien": "https://www.hautemorges.ch/_doc/4145120"
    },
    {
      "titre": "Preavis_20_2022_-_Prt_jeunesse_Apples.pdf",
      "date": null,
      "lien": "https://www.hautemorges.ch/_doc/4145123"
    },
    {
      "titre": "Preavis_20_2022_-_Prt_jeunesse_Apples_-_annexe.pdf",
      "date": null,
      "lien": "https://www.hautemorges.ch/_doc/4145126"
    },
    {
      "titre": "Preavis_21_2022_-_Reglement_Conseil.pdf",
      "date": null,
      "lien": "https://www.hautemorges.ch/_doc/4145129"
    },
    {
      "titre": "Preavis_21_2022_-_Reglement_Conseil_-_annexe_1.pdf",
      "date": null,
      "lien": "https://www.hautemorges.ch/_doc/4145132"
    },
    {
      "titre": "Preavis_21_2022_-_Reglement_Conseil_-_annexe_2.pdf",
      "date": null,
      "lien": "https://www.hautemorges.ch/_doc/4145135"
    },
    {
      "titre": "Preavis_16_2022_-_Budget_2023_-_annexe.pdf",
      "date": null,
      "lien": "https://www.hautemorges.ch/_doc/4155434"
    },
    {
      "titre": "CC_Decisions_du_12.12.2022.pdf",
      "date": null,
      "lien": "https://www.hautemorges.ch/_doc/4160261"
    },
    {
      "titre": "2022_12_12_PV_no_09_2022.pdf",
      "date": null,
      "lien": "https://www.hautemorges.ch/_doc/4202510"
    },
    {
      "titre": "Presentation_Info_risque_de_penurie.pdf",
      "date": null,
      "lien": "https://www.hautemorges.ch/_doc/4202513"
    },
    {
      "titre": "Presentation_PDDE.pdf",
      "date": null,
      "lien": "https://www.hautemorges.ch/_doc/4202516"
    }
  ]
}
