{
  "version": 1,
  "genere": "2026-10-16T16:21:04Z",
  "id": 13707,
  "date": "2009-03-03",
  "nom": "Séance du 3 mars 2009",
  "lien": "https://www.vd.ch/gc/seances-precedentes/annee-2009/seance-du-3-mars-2009",
  "ordre_du_jour": [
    {
      "numero": "4",
      "titre": "Interpellation Véronique Hurni et consorts concernant les modifications tarifaires des petits laboratoires médicaux et les projets de déménagements des labos du CHUV. (Ne souhaite pas développer).",
      "categorie": null,
      "resultat": "RENV-CE",
      "objet": "vd/09_INT_194"
    },
    {
      "numero": "5",
      "titre": "Développement de la motion Christiane Jaquet-Berger et consorts concernant un prise en compte concrète du mouvement associatif et du bénévolat dans la société vaudoise, de son appui et de son encouragement par l'Etat et par les communes, sur la base des principes de l'article 70 de la Constitution. (Souhaite développer et demande le renvoi à comm. avec plus de 20 signatures).",
      "categorie": null,
      "resultat": "RENV-COM",
      "objet": "vd/09_MOT_065"
    },
    {
      "numero": "6",
      "titre": "Développement du postulat Jérôme Christen et consorts demandant au Conseil d'Etat d'obtenir une indemnisation correcte dans le cadre de l'incendie du bâtiment Perregaux. (Souhaite développer et demande le renvoi au CE avec plus de 20 signatures).",
      "categorie": null,
      "resultat": "RENV-CE",
      "objet": "vd/09_POS_118"
    },
    {
      "numero": "7",
      "titre": "Interpellation Olivier Feller au nom du groupe radical concernant l'avenir pour des subventions versées par l'Etat de Vaud aux organisations affiliées à la CPCL. (Souhaite développer).",
      "categorie": null,
      "resultat": "RENV-CE",
      "objet": "vd/09_INT_195"
    },
    {
      "numero": "8",
      "titre": "Réponse du Conseil d'Etat à l'interpellation Michaël Buffat au nom du groupe UDC concernant la crise des marchés financiers et la Caisse de pensions de l'Etat de Vaud CPEV.",
      "categorie": null,
      "resultat": "TRAITE",
      "objet": "vd/09_INT_126"
    },
    {
      "numero": "9",
      "titre": "Postulat du groupe socialiste et consorts concernant les mesures et actions qu'entend entreprendre le Conseil d'Etat compte tenu de la crise financière internationale et de la crise économique.",
      "categorie": null,
      "resultat": "REF",
      "objet": "vd/08_POS_096"
    },
    {
      "numero": "10",
      "titre": "Réponse du Conseil d'Etat à l'interpellation Michaël Buffat demandant, pour la Maison des cantons, quel fédéralisme et à quel prix.",
      "categorie": null,
      "resultat": "TRAITE",
      "objet": "vd/08_INT_138"
    },
    {
      "numero": "11",
      "titre": "Postulat Roger Saugy et consorts demandant une participation fiscale plus claire et plus transparente des députés au Grand Conseil. DFIRE, DINT.",
      "categorie": null,
      "resultat": "REF",
      "objet": "vd/08_POS_062"
    },
    {
      "numero": "12",
      "titre": "Exposé des motifs et projet de loi modifiant la loi sur la police cantonale du 17 novembre 1975 en vue de percevoir des frais d'intervention. (1er débat).",
      "categorie": null,
      "resultat": "OA+M",
      "objet": null
    },
    {
      "numero": "13",
      "titre": "Réponse du Conseil d'Etat à l'interpellation Grégory Devaud concernant l'avant-projet de 3ème correction du Rhône.",
      "categorie": null,
      "resultat": "TRAITE",
      "objet": "vd/08_INT_127"
    },
    {
      "numero": "14",
      "titre": "Réponse du Conseil d'Etat à l'interpellation Jean-Marc Chollet et consorts - Le SAN filtre les filtres à particules.",
      "categorie": null,
      "resultat": "TRAITE",
      "objet": "vd/06_INT_340"
    },
    {
      "numero": "15",
      "titre": "Réponse du Conseil d'Etat aux interpellations :- Michel Miéville et consorts - L'approvisionnement du Canton de Vaud en énergie électrique est-il assuré ? (08_INT_075)- Jean-Christophe Schwaab et consorts - Le Conseil d'Etat va-t-il s'opposer à une nouvelle centrale nucléaire à 80 km du canton ? (08_INT_111)- Yves Ferrari - ATEL et EOS une fusion sans fission ! (08_INT_109)",
      "categorie": null,
      "resultat": "TRAITE",
      "objet": "vd/08_INT_075"
    },
    {
      "numero": "16",
      "titre": "Réponse du Conseil d'Etat à l'interpellation Félix Glutz concernant l'égalité Homme et Femme et la Charia.",
      "categorie": null,
      "resultat": "RENV-T",
      "objet": "vd/08_INT_140"
    },
    {
      "numero": "17",
      "titre": "Rapport du Conseil d'Etat au Grand Conseil sur le postulat Sandrine Bavaud et consorts pour une répartition du travail rémunéré et non rémunéré.",
      "categorie": null,
      "resultat": "RENV-T",
      "objet": null
    },
    {
      "numero": "18",
      "titre": "Pétition pour une construction rapide du collège à Préverenges.",
      "categorie": null,
      "resultat": "RENV-T",
      "objet": "vd/08_PET_019"
    },
    {
      "numero": "19",
      "titre": "Rapport du Conseil d'Etat au Grand Conseil sur le postulat Philippe Leuba - Seul Thésée pourrait être maman de jour agréée ! DFJC. Décaillet A.",
      "categorie": null,
      "resultat": "RENV-T",
      "objet": null
    },
    {
      "numero": "20",
      "titre": "Exposé des motifs et projet de décret accordant une subvention à l'Institut des hautes études en administration publique (1er débat).",
      "categorie": null,
      "resultat": "RENV-T",
      "objet": null
    },
    {
      "numero": "21",
      "titre": "Postulat Anne Papilloud et consorts intitulé Vous chantiez j'en suis fort aise. DFJC.",
      "categorie": null,
      "resultat": "RENV-T",
      "objet": "vd/08_POS_090"
    },
    {
      "numero": "22",
      "titre": "Exposé des motifs et projet de décrets autorisant le Conseil d'Etat a adhérer à la Convention intercantonale sur l’Hôpital Riviera-Chablais Vaud-Valais pour l'emprunt bancaire de CHF 16,125 millions contracté pour financer le concours et les études en vue de la construction de l'hôpital Riviera-Chablais Vaud-Valais sur le site de Rennaz (amendé suite aux travaux de la Commission interparlementaire Vaud-Valais) et Réponse du Conseil d'Etat à l’interpellation Pierre Rochat et consorts concernant l'avenir des établissements sanitaires privés d'intérêt public (2ème débat).",
      "categorie": null,
      "resultat": "RENV-T",
      "objet": null
    },
    {
      "numero": "23",
      "titre": "Rapport du Conseil d'Etat au Grand Conseil sur le postulat Bernard Borel et consorts concernant la politique du Conseil d'Etat relative aux subsides cantonaux aux primes d'assurance maladie obligatoire.",
      "categorie": null,
      "resultat": "RENV-T",
      "objet": null
    },
    {
      "numero": "24",
      "titre": "Postulat Bernard Borel et consort sur la prise en charge des soins médicaux des requérants déboutés et de ceux frappés de non entrée en matière. DSAS.",
      "categorie": null,
      "resultat": "RENV-T",
      "objet": "vd/08_POS_079"
    },
    {
      "numero": "25",
      "titre": "Exposé des motifs et projet de loi modifiant :- la loi du 29 mai 1985 sur la santé publique (LSP) et répondant à la motion Jean-Marie Surer et consorts (05/MOT/083) demandant une révision de la loi sur la santé publique afin d'autoriser les médecins-vétérinaires pratiquant dans le canton de Vaud à dispenser des médicaments ainsi que le préavis du Conseil d'Etat au Grand Conseil sur l'initiative législative Massimo Sandri et consorts visant la promotion de la santé sexuelle et procréative- la loi du 10 février 2004 sur les mesures d'aide et d'intégration pour personnes handicapées (LAIH) (1er débat).",
      "categorie": null,
      "resultat": "RENV-T",
      "objet": null
    },
    {
      "numero": "26",
      "titre": "Exposé des motifs et projet de décret accordant la garantie de l’Etat de Vaud et la prise en charge du service de la dette sur les emprunts contractés ou à contracter par la Fondation La Clef des Champs – Fondation Belle Saison dès 2009 – jusqu’à concurrence de CHF 15'557'867.- afin de financer, d’une part, les immobilisations actuelles de cette institution et, d’autre part, la transformation et l’agrandissement de l’EMS La Clef des Champs à Mont-sur-Rolle (1er débat).",
      "categorie": null,
      "resultat": "RENV-T",
      "objet": null
    },
    {
      "numero": "27",
      "titre": "Rapport du Conseil d'Etat au Grand Conseil sur le postulat Olivier Feller et consorts demandant au Conseil d'Etat d'élaborer un plan d'actions pour faire face au réchauffement climatique dans les stations d'hiver vaudoises.",
      "categorie": null,
      "resultat": "RENV-T",
      "objet": null
    },
    {
      "numero": "28",
      "titre": "Motion Bernard Borel et consorts pour la création d'un fond de démarrage pour les projets d'agriculture contractuelle de proximité. DEC.",
      "categorie": null,
      "resultat": "RENV-T",
      "objet": "vd/08_MOT_045"
    },
    {
      "numero": "29",
      "titre": "Réponse du Conseil d'Etat à l'interpellation Pierre-André Pidoux au nom du groupe UDC concernant le libre-échange agricole et ses effets pour l'agriculture de notre canton. DEC.",
      "categorie": null,
      "resultat": "RENV-T",
      "objet": "vd/08_INT_135"
    }
  ]
}
