{
  "version": 1,
  "genere": "2026-10-16T16:21:04Z",
  "id": 13864,
  "date": "2013-06-04",
  "nom": "Séance du 4 juin2013",
  "lien": "https://www.vd.ch/gc/seances-precedentes/annee-2013/seance-du-4-juin-2013",
  "ordre_du_jour": [
    {
      "numero": "3",
      "titre": "Interpellation Philippe Vuillemin - Le bracelet électronique : pourquoi cette dérive ? (pas de développement).",
      "categorie": null,
      "resultat": "RENV-CE",
      "objet": "vd/13_INT_128"
    },
    {
      "numero": "4",
      "titre": "Interpellation Christiane Jaquet-Berger et consorts - La prise en charge pédopsychiatrique dépendra-t-elle, à l'Hôpital intercantonal Riviera-Chablais, d'une logique de santé publique ou d'une logique de territoires cantonaux ? (pas de développement).",
      "categorie": null,
      "resultat": "RENV-CE",
      "objet": "vd/13_INT_129"
    },
    {
      "numero": "5",
      "titre": "Interpellation Jean-Michel Favez relative aux trop nombreuses infractions dénoncées dans le secteur des métiers de bouche et des activités analogues (pas de développement).",
      "categorie": null,
      "resultat": "RENV-CE",
      "objet": "vd/13_INT_130"
    },
    {
      "numero": "6",
      "titre": "Interpellation Jean Tschopp et consorts - Alcoolisation des mineurs : mettre les exploitants d'établissements et de commerces face à leurs responsabilités (développement).",
      "categorie": null,
      "resultat": "RENV-CE",
      "objet": "vd/13_INT_131"
    },
    {
      "numero": "7",
      "titre": "Interpellation Andreas Wüthrich - Les CFF sont-ils sur un nuage ? (développement).",
      "categorie": null,
      "resultat": "RENV-CE",
      "objet": "vd/13_INT_132"
    },
    {
      "numero": "8",
      "titre": "Interpellation Philippe Grobéty et consorts - Beaucoup d'emplois seront perdus dans les régions à fort taux de résidences secondaires (développement).",
      "categorie": null,
      "resultat": "RENV-CE",
      "objet": "vd/13_INT_133"
    },
    {
      "numero": "9",
      "titre": "Interpellation Christa Calpini - La prison du Bois-Mermet, point de rencontre des Pink Panthers ? (développement).",
      "categorie": null,
      "resultat": "RENV-CE",
      "objet": "vd/13_INT_134"
    },
    {
      "numero": "10",
      "titre": "Postulat Marc-Olivier Buffat et consorts - Modification de l'art. 131 al. 3 de la Constitution vaudoise - Appartenance politique des Juges cantonaux en question (renvoi à commission avec au moins 20 signatures).",
      "categorie": null,
      "resultat": "RENV-COM",
      "objet": "vd/13_POS_037"
    },
    {
      "numero": "11",
      "titre": "Motion Véronique Hurni et consorts - Soins de logopédie - pas d'attente pour nos enfants (renvoi à commission avec au moins 20 signatures).",
      "categorie": null,
      "resultat": "RENV-COM",
      "objet": "vd/13_MOT_027"
    },
    {
      "numero": "12",
      "titre": "Pétition en faveur d'Idriz Rexhaj, Ganimete Metaj et Leon Metaj",
      "categorie": null,
      "resultat": "REF",
      "objet": "vd/12_PET_007"
    },
    {
      "numero": "13",
      "titre": "Exposé des motifs et projet de décret accordant au Conseil d'Etat un crédit-cadre (2013-2016) de CHF 22,8 millions pour financer l'entretien lourd et améliorer les performances énergétiques des bâtiments propriété de l'Etat etRapport intermédiaire du Conseil d'Etat au Grand Conseil sur l'utilisation du crédit-cadre de CHF 22 millions alloué par décret du 15 janvier 2008 pour financer le rattrapage de l'entretien différé des bâtiments propriété de l'Etat (situation au 31 décembre 2011) etRapport du Conseil d'Etat au Grand Conseil sur le postulat Olivier Feller et consorts au nom du groupe radical - Réduire la consommation d'électricité de l'Etat (11_POS_247)(1er débat)",
      "categorie": null,
      "resultat": "OA",
      "objet": null
    },
    {
      "numero": "14",
      "titre": "Exposé des motifs et projet de lois- sur les hautes écoles vaudoises de type HES- modifiant la loi du 19 septembre 1978 sur les activités culturelles(2ème débat)",
      "categorie": null,
      "resultat": "OA+M",
      "objet": null
    },
    {
      "numero": "15",
      "titre": "Motion Mathieu Blanc et consorts pour l'adoption de dispositions légales relatives à des mesures d'éloignement afin que les citoyens se réapproprient le domaine public. DSE, DINT.",
      "categorie": null,
      "resultat": "RENV-CE",
      "objet": "vd/12_MOT_005"
    },
    {
      "numero": "16",
      "titre": "Réponse du Conseil d'Etat à l'interpellation Florence Golaz et consorts - Représentant des communes \"sans police communale\" au Conseil cantonal de sécurité : une procédure de nomination et de communication à améliorer",
      "categorie": null,
      "resultat": "TRAITE",
      "objet": "vd/13_INT_094"
    },
    {
      "numero": "17",
      "titre": "Réponse du Conseil d'Etat à l'interpellation Denis Rubattel - Via sicura : problèmes liés à la séquestration des véhicules ?",
      "categorie": null,
      "resultat": "TRAITE",
      "objet": "vd/13_INT_090"
    },
    {
      "numero": "18",
      "titre": "Exposé des motifs et projet de décret du Bureau du Grand Conseil fixant la rémunération du Secrétaire général du Grand Conseil pour la législature 2013-2017 etExposé des motifs et projet de lois modifiant la loi du 8 mai 2007 sur le Grand Conseil (LGC).",
      "categorie": null,
      "resultat": "OA",
      "objet": null
    },
    {
      "numero": "19",
      "titre": "Pétition concernant la fermeture du guichet CFF de Moudon",
      "categorie": null,
      "resultat": "RENV-CE",
      "objet": "vd/13_PET_010"
    },
    {
      "numero": "20",
      "titre": "Exposé des motifs et projet de décret accordant au Conseil d'Etat un crédit-cadre de CHF 8'550'000.- destiné à financer la réalisation des mesures d'assainissement contre le bruit le long des routes cantonales selon la convention programme signée entre le Canton et la Confédération pour la période 2012-2015(1er débat)",
      "categorie": null,
      "resultat": "OA",
      "objet": null
    },
    {
      "numero": "21",
      "titre": "Exposé des motifs et projet de décret accordant au Conseil d'Etat un crédit d'investissement de CHF 1'940'000.- pour financer l'entretien lourd de trois giratoires Poissine, Mottey et Champ-Courbe sur la route RC 401-B-P entre la jonction autoroutière de Corcelettes près de Grandson et Concise, sur le territoire des communes de Grandson, Bonvillars, Onnens et de Corcelles-près-Concise (1er débat)",
      "categorie": null,
      "resultat": "OA",
      "objet": null
    },
    {
      "numero": "22",
      "titre": "Réponse du Conseil d'Etat à l'interpellation Vassilis Venizelos au nom du groupe des Verts - Assainissement du tunnel routier du Gothard : \"Ô forage, Ô désespoir\" DIRH.",
      "categorie": null,
      "resultat": "RENV-T",
      "objet": "vd/13_INT_101"
    },
    {
      "numero": "23",
      "titre": "Réponse du Conseil d'Etat à l'interpellation Dominique Bonny - Des glissières de sécurité sécurisées DIRH.",
      "categorie": null,
      "resultat": "RENV-T",
      "objet": "vd/13_INT_084"
    },
    {
      "numero": "24",
      "titre": "Postulat Jean-Michel Dolivo et consorts concernant l'accueil de l'enfance, hâte-toi lentement ! DIRH.",
      "categorie": null,
      "resultat": "RENV-T",
      "objet": "vd/12_POS_010"
    },
    {
      "numero": "25",
      "titre": "Motion Jean-Michel Dolivo et consorts - Les locataires ne doivent plus perdre tous leurs droits dès lors qu'ils n'ont pas pu être présents à une audience de la Commission de conciliation ! DINT.",
      "categorie": null,
      "resultat": "RENV-T",
      "objet": "vd/12_MOT_014"
    },
    {
      "numero": "26",
      "titre": "Réponse du Conseil d'Etat à l'interpellation Claude-Alain Voiblet - Qui est aux commandes du \" Projet de territoire Suisse\" ? DINT.",
      "categorie": null,
      "resultat": "RENV-T",
      "objet": "vd/12_INT_023"
    },
    {
      "numero": "27",
      "titre": "Réponse du Conseil d'Etat à l'interpellation Alice Glauser - Extension future du Centre de Détention de la Croisée, qualité exigée ! DINT.",
      "categorie": null,
      "resultat": "RENV-T",
      "objet": "vd/12_INT_058"
    },
    {
      "numero": "28",
      "titre": "Motion Catherine Labouchère et consorts concernant le plan directeur cantonal (PDCn) - modification de la mesure A12. DINT.",
      "categorie": null,
      "resultat": "RENV-T",
      "objet": "vd/12_MOT_007"
    },
    {
      "numero": "29",
      "titre": "Motion Christelle Luisier Brodard et consorts concernant la mesure A11 du Plan directeur cantonal - nécessité d'une solution plus souple afin de favoriser la création de logements. DINT.",
      "categorie": null,
      "resultat": "RENV-T",
      "objet": "vd/12_MOT_008"
    },
    {
      "numero": "30",
      "titre": "Interpellation Filip Uffer et consorts - Appartenance religieuse dans le Registre cantonal des personnes (Développement).",
      "categorie": null,
      "resultat": "RENV-CE",
      "objet": "vd/13_INT_126"
    }
  ]
}
