{
  "version": 1,
  "genere": "2026-10-24T14:37:59Z",
  "id": null,
  "date": "2026-10-05T20:15",
  "nom": "Séance ordinaire du Conseil communal",
  "lien": "https://www.coppet.ch/_rte/anlass/7720153",
  "ordre_du_jour": [],
  "documents": [
    {
      "titre": "conditions_utilisation_coppet.pdf",
      "date": null,
      "lien": "https://www.coppet.ch/_doc/646122"
    },
    {
      "titre": "Ordre du jour de la séance du 5 octobre 2026",
      "date": null,
      "lien": "https://www.coppet.ch/_doc/7252051"
    },
    {
      "titre": "Présentation Conseil communal du 5 octobre 2026",
      "date": null,
      "lien": "https://www.coppet.ch/_doc/7276612"
    },
    {
      "titre": "Extrait PV 05.10.2026 - Préavis 04/2026-2027",
      "date": null,
      "lien": "https://www.coppet.ch/_doc/7277593"
    },
    {
      "titre": "Extrait PV 05.10.2026 - Préavis 05/2026-2027",
      "date": null,
      "lien": "https://www.coppet.ch/_doc/7277596"
    },
    {
      "titre": "Extrait PV 05.10.2026 - Préavis 06/2026-2027",
      "date": null,
      "lien": "https://www.coppet.ch/_doc/7277599"
    },
    {
      "titre": "Extrait PV 05.10.2026 - Préavis 07/2026-2027",
      "date": null,
      "lien": "https://www.coppet.ch/_doc/7277602"
    },
    {
      "titre": "Extrait PV 05.10.2026 - Préavis 08/2026-2027",
      "date": null,
      "lien": "https://www.coppet.ch/_doc/7277605"
    },
    {
      "titre": "Extrait PV 05.10.2026 - Préavis 09/2026-2027",
      "date": null,
      "lien": "https://www.coppet.ch/_doc/7277608"
    },
    {
      "titre": "Extrait PV 05.10.2026 - Préavis 10/2026-2027",
      "date": null,
      "lien": "https://www.coppet.ch/_doc/7277611"
    },
    {
      "titre": "Extrait PV 05.10.2026 - Préavis 11/2026-2027",
      "date": null,
      "lien": "https://www.coppet.ch/_doc/7277614"
    },
    {
      "titre": "Extrait PV 05.10.2026 - Préavis 12/2026-2027",
      "date": null,
      "lien": "https://www.coppet.ch/_doc/7277617"
    },
    {
      "titre": "Extrait PV 05.10.2026 - Préavis 13/2026-2027",
      "date": null,
      "lien": "https://www.coppet.ch/_doc/7277620"
    }
  ]
}
