{
  "version": 1,
  "genere": "2026-10-31T14:19:46Z",
  "id": null,
  "date": "2024-05-16T20:00",
  "nom": "Séance du Conseil communal",
  "lien": "https://www.preverenges.ch/_rte/anlass/5661202",
  "ordre_du_jour": [],
  "documents": [
    {
      "titre": "1. Convocation CC du 16.05.24",
      "date": null,
      "lien": "https://www.preverenges.ch/_doc/5097844"
    },
    {
      "titre": "2. Préavis 5-24 - Modification des status SIS Morget",
      "date": null,
      "lien": "https://www.preverenges.ch/_doc/5120953"
    },
    {
      "titre": "2.1 Préavis 5-24 Annexe 1",
      "date": null,
      "lien": "https://www.preverenges.ch/_doc/5120956"
    },
    {
      "titre": "2.2 Préavis 5-24 Annexe 2",
      "date": null,
      "lien": "https://www.preverenges.ch/_doc/5120959"
    },
    {
      "titre": "3. Préavis 6-24 - Les Petites Voiles 2024",
      "date": null,
      "lien": "https://www.preverenges.ch/_doc/5120962"
    },
    {
      "titre": "3.1 Préavis 6-24 Annexe 1",
      "date": null,
      "lien": "https://www.preverenges.ch/_doc/5120965"
    },
    {
      "titre": "3.2 Préavis 6-24 Annexe 2",
      "date": null,
      "lien": "https://www.preverenges.ch/_doc/5120968"
    },
    {
      "titre": "4. Décisions CC du 16.5.24",
      "date": null,
      "lien": "https://www.preverenges.ch/_doc/5120971"
    },
    {
      "titre": "5. PV du 21.3.24 approuvé le 16.5.24",
      "date": null,
      "lien": "https://www.preverenges.ch/_doc/5120974"
    }
  ]
}
