{
  "version": 1,
  "genere": "2026-10-16T16:21:04Z",
  "id": 32926,
  "date": "2024-12-12T20:00",
  "nom": "Séance du Conseil communal du 12 décembre 2024",
  "lien": "https://www.yverdon-les-bains.ch/vie-politique/conseil-communal/seances",
  "ordre_du_jour": [
    {
      "numero": "1",
      "titre": "Appel",
      "categorie": null,
      "resultat": null,
      "objet": null
    },
    {
      "numero": "2",
      "titre": "Approbation de l’ordre du jour",
      "categorie": null,
      "resultat": null,
      "objet": null
    },
    {
      "numero": "3",
      "titre": "Démissions",
      "categorie": null,
      "resultat": null,
      "objet": null
    },
    {
      "numero": "4",
      "titre": "Assermentations",
      "categorie": null,
      "resultat": null,
      "objet": null
    },
    {
      "numero": "5",
      "titre": "Communications de la Présidente",
      "categorie": null,
      "resultat": null,
      "objet": null
    },
    {
      "numero": "6",
      "titre": "Communications et réponses de la Municipalité",
      "categorie": null,
      "resultat": null,
      "objet": null
    },
    {
      "numero": "7",
      "titre": "Nomination d'un·e membre suppléant·e à la Commission des affaires immobilières",
      "categorie": null,
      "resultat": null,
      "objet": null
    },
    {
      "numero": "8",
      "titre": "Nomination d'un·e membre suppléant·e à la Commission des pétitions",
      "categorie": null,
      "resultat": null,
      "objet": null
    },
    {
      "numero": "9",
      "titre": "PR24.30PR concernant le budget 2025",
      "categorie": null,
      "resultat": null,
      "objet": null
    },
    {
      "numero": "10",
      "titre": "PR24.32PR concernant une demande de crédit complémentaire extraordinaire de CHF 200'000.- au budget 2024 pour un soutien exceptionnel urgent à la Fondation de la Maison d’Ailleurs",
      "categorie": null,
      "resultat": null,
      "objet": null
    },
    {
      "numero": "11",
      "titre": "PR24.31PR concernant la 2e série de compléments au budget 2024",
      "categorie": null,
      "resultat": null,
      "objet": null
    },
    {
      "numero": "12",
      "titre": "Interpellations, simples questions et vœux.",
      "categorie": null,
      "resultat": null,
      "objet": null
    }
  ]
}
