{
  "version": 1,
  "genere": "2026-10-31T18:25:25Z",
  "id": null,
  "date": "2019-12-09",
  "nom": "Conseil Général",
  "lien": "https://www.allaman.ch/_rte/anlass/4620785",
  "ordre_du_jour": [],
  "documents": [
    {
      "titre": "0. Ordre du Jour - 9.12.2019",
      "date": null,
      "lien": "https://www.allaman.ch/_doc/2911121"
    },
    {
      "titre": "3-2019 - Préavis relatif au Budget 2020",
      "date": null,
      "lien": "https://www.allaman.ch/_doc/2912342"
    },
    {
      "titre": "3-2019 - Budget 2020",
      "date": null,
      "lien": "https://www.allaman.ch/_doc/2912345"
    },
    {
      "titre": "5-2019 - Préavis relatif à la rénovation et à l'agrandissement de la Salle Communale",
      "date": null,
      "lien": "https://www.allaman.ch/_doc/2912348"
    },
    {
      "titre": "5-2019 - Plan avec \"vue du ciel\"",
      "date": null,
      "lien": "https://www.allaman.ch/_doc/2912351"
    }
  ]
}
