{
  "version": 1,
  "genere": "2026-10-31T16:26:32Z",
  "id": null,
  "date": "2023-10-31T20:00",
  "nom": "Séance du Conseil communal du 31 octobre 2023",
  "lien": "https://www.blonay-saint-legier.ch/_rte/anlass/5249866",
  "ordre_du_jour": [
    {
      "numero": "01",
      "titre": "Adoption de l'ordre du jour définitif Ordre du jour (PDF, 634 kB) Téléchargement",
      "categorie": null,
      "resultat": null,
      "objet": null
    },
    {
      "numero": "02",
      "titre": "Adoption du procès-verbal de la séance du Conseil communal du 26 septembre 2023",
      "categorie": null,
      "resultat": null,
      "objet": null
    },
    {
      "numero": "03",
      "titre": "Assermentation",
      "categorie": null,
      "resultat": null,
      "objet": null
    },
    {
      "numero": "04",
      "titre": "Nomination d'un membre à la COGEST et à la commission de recours",
      "categorie": null,
      "resultat": null,
      "objet": null
    },
    {
      "numero": "05",
      "titre": "Communications du bureau du Conseil",
      "categorie": null,
      "resultat": null,
      "objet": null
    },
    {
      "numero": "06",
      "titre": "Communications de la Municipalité",
      "categorie": null,
      "resultat": null,
      "objet": null
    },
    {
      "numero": "07",
      "titre": "Réponses de la Municipalité aux initiatives déposées lors des séances précédentes",
      "categorie": null,
      "resultat": null,
      "objet": null
    },
    {
      "numero": "08",
      "titre": "Préavis 23-2023 concernant l'arrêté d'imposition pour les années 2024-2026",
      "categorie": null,
      "resultat": null,
      "objet": null
    },
    {
      "numero": "09",
      "titre": "Préavis 24-2023 concernant la révision du règlement sur la gestion des déchets, suite à la fusion des communes de St-Légier-La Chiésaz et Blonay",
      "categorie": null,
      "resultat": null,
      "objet": null
    },
    {
      "numero": "11",
      "titre": "Dépôt d'initiatives (motions, postulats, interpellations)",
      "categorie": null,
      "resultat": null,
      "objet": null
    },
    {
      "numero": "12",
      "titre": "Informations de nos représentants siégeant dans les organismes intercommunaux",
      "categorie": null,
      "resultat": null,
      "objet": null
    },
    {
      "numero": "13",
      "titre": "Propositions individuelles et divers",
      "categorie": null,
      "resultat": null,
      "objet": null
    }
  ],
  "documents": [
    {
      "titre": "Procès-verbal du 31 octobre 2023",
      "date": null,
      "lien": "https://www.blonay-saint-legier.ch/_doc/5021677"
    },
    {
      "titre": "Ordre du jour",
      "date": null,
      "lien": "https://www.blonay-saint-legier.ch/_doc/4793686"
    }
  ]
}
