{
  "version": 1,
  "genere": "2026-10-16T16:21:04Z",
  "id": 32927,
  "date": "2020-02-06T20:00",
  "nom": "Séance du Conseil communal du 6 février 2020",
  "lien": "https://www.yverdon-les-bains.ch/vie-politique/conseil-communal/seances",
  "ordre_du_jour": [
    {
      "numero": "1",
      "titre": "Appel",
      "categorie": null,
      "resultat": null,
      "objet": null
    },
    {
      "numero": "2",
      "titre": "Approbation de l’ordre du jour",
      "categorie": null,
      "resultat": null,
      "objet": null
    },
    {
      "numero": "3",
      "titre": "Approbation du procès-verbal de la séance du 7 novembre 2019",
      "categorie": null,
      "resultat": null,
      "objet": null
    },
    {
      "numero": "4",
      "titre": "Approbation du procès-verbal de la séance du 5 décembre 2019",
      "categorie": null,
      "resultat": null,
      "objet": null
    },
    {
      "numero": "5",
      "titre": "Démissions",
      "categorie": null,
      "resultat": null,
      "objet": null
    },
    {
      "numero": "6",
      "titre": "Communications du Président",
      "categorie": null,
      "resultat": null,
      "objet": null
    },
    {
      "numero": "7",
      "titre": "Communications et réponses de la Municipalité : CO20.01, PO12.01REP",
      "categorie": null,
      "resultat": null,
      "objet": null
    },
    {
      "numero": "8",
      "titre": "Propositions individuelles et interpellations reportées de la séance du 12 décembre 2019",
      "categorie": null,
      "resultat": null,
      "objet": null
    },
    {
      "numero": "9",
      "titre": "PR19.32PR concernant la création d’une société anonyme pour le développement des réseaux thermiques",
      "categorie": null,
      "resultat": null,
      "objet": null
    },
    {
      "numero": "10",
      "titre": "PR19.33PR concernant une demande de crédit d’investissement de CHF 1’450’000.- pour la modernisation et l’extension des réseaux informatiques pédagogiques dans les bâtiments scolaires",
      "categorie": null,
      "resultat": null,
      "objet": null
    },
    {
      "numero": "11",
      "titre": "PR19.34PR concernant une demande de crédit d’investissement de CHF 800’000.- pour l'installation et le remplacement des compteurs, les modifications et petites extensions des réseaux prévisionnels pour l'année 2020",
      "categorie": null,
      "resultat": null,
      "objet": null
    },
    {
      "numero": "12",
      "titre": "Projet de modification du règlement du Conseil communal, à l’article 73 Déposé par [particulier]",
      "categorie": null,
      "resultat": null,
      "objet": null
    },
    {
      "numero": "13",
      "titre": "Propositions individuelles et interpellations.",
      "categorie": null,
      "resultat": null,
      "objet": null
    }
  ]
}
