{
  "version": 1,
  "genere": "2026-10-31T16:26:32Z",
  "id": null,
  "date": "2022-03-29T20:00",
  "nom": "Séance du Conseil communal du 29 mars 2022",
  "lien": "https://www.blonay-saint-legier.ch/_rte/anlass/4828942",
  "ordre_du_jour": [],
  "documents": [
    {
      "titre": "Ordre du jour définitif",
      "date": null,
      "lien": "https://www.blonay-saint-legier.ch/_doc/3610763"
    },
    {
      "titre": "Procès-verbal de la séance du 29 mars 2022",
      "date": null,
      "lien": "https://www.blonay-saint-legier.ch/_doc/3695971"
    }
  ]
}
